idx	imgs	err1	err2	res1	res2
541	20-4##20-16	0	-1	{'org_sentence': 'The lotus in both pictures is blooming, and the left picture has exactly one purple-red lotus.', 'sentence': 'The lotus in both pictures is blooming, and the left picture has exactly one purple-red lotus.', 'prediction': 0, 'label': 0}	{'org_sentence': 'The lotus in both pictures is blooming, and the left picture has exactly one purple-red lotus.', 'sentence': 'Left part scenario:pink water lily ,right part scenario: the scene is in a pond. Therefore, the sentence is right or wrong: The lotus in both pictures is blooming, and the left picture has exactly one purple-red lotus.', 'prediction': 1, 'label': 0}
543	20-2##20-19	1	0	{'org_sentence': 'The lotus in both pictures is blooming, and the left picture has exactly one purple-red lotus.', 'sentence': 'The lotus in both pictures is blooming, and the left picture has exactly one purple-red lotus.', 'prediction': 0, 'label': 1}	{'org_sentence': 'The lotus in both pictures is blooming, and the left picture has exactly one purple-red lotus.', 'sentence': 'Left part scenario:a pond ,right part scenario: the scene is outdoors. Therefore, the sentence is right or wrong: The lotus in both pictures is blooming, and the left picture has exactly one purple-red lotus.', 'prediction': 1, 'label': 1}
551	13-3##13-5	0	1	{'org_sentence': 'The ginkgo tree in the picture on the right is dark green, and the picture on the left is brilliant.', 'sentence': 'The ginkgo tree in the picture on the right is dark green, and the picture on the left is brilliant.', 'prediction': 1, 'label': 1}	{'org_sentence': 'The ginkgo tree in the picture on the right is dark green, and the picture on the left is brilliant.', 'sentence': 'Left part scenario:a street lined with buildings ,right part scenario: a cemetery. Therefore, the sentence is right or wrong: The ginkgo tree in the picture on the right is dark green, and the picture on the left is brilliant.', 'prediction': 0, 'label': 1}
553	49-3##49-14	0	1	{'org_sentence': 'At least one person is playing the Guzheng in the picture on the left, and no one on the right.', 'sentence': 'At least one person is playing the Guzheng in the picture on the left, and no one on the right.', 'prediction': 1, 'label': 1}	{'org_sentence': 'At least one person is playing the Guzheng in the picture on the left, and no one on the right.', 'sentence': 'Left part scenario:a classroom ,right part scenario: a music stand. Therefore, the sentence is right or wrong: At least one person is playing the Guzheng in the picture on the left, and no one on the right.', 'prediction': 0, 'label': 1}
560	40-5##40-11	-1	0	{'org_sentence': 'The scissors in one picture have not been unpacked, and the scissors in the other picture have been unpacked.', 'sentence': 'The scissors in one picture have not been unpacked, and the scissors in the other picture have been unpacked.', 'prediction': 1, 'label': 0}	{'org_sentence': 'The scissors in one picture have not been unpacked, and the scissors in the other picture have been unpacked.', 'sentence': 'Left part scenario:a pair of scissors ,right part scenario: a person holding a pair of scissors. Therefore, the sentence is right or wrong: The scissors in one picture have not been unpacked, and the scissors in the other picture have been unpacked.', 'prediction': 0, 'label': 0}
566	2-7##2-5	1	0	{'org_sentence': 'The crows in the two pictures are flying without spreading their wings, and there are at least five crows in one of the pictures.', 'sentence': 'The crows in the two pictures are flying without spreading their wings, and there are at least five crows in one of the pictures.', 'prediction': 0, 'label': 1}	{'org_sentence': 'The crows in the two pictures are flying without spreading their wings, and there are at least five crows in one of the pictures.', 'sentence': 'Left part scenario:birds on a wire ,right part scenario: a bird feeder. Therefore, the sentence is right or wrong: The crows in the two pictures are flying without spreading their wings, and there are at least five crows in one of the pictures.', 'prediction': 1, 'label': 1}
569	56-7##56-17	-1	0	{'org_sentence': 'There is fried rice in the picture on the left, and there is no fried rice or similar dishes in the picture on the right.', 'sentence': 'There is fried rice in the picture on the left, and there is no fried rice or similar dishes in the picture on the right.', 'prediction': 1, 'label': 0}	{'org_sentence': 'There is fried rice in the picture on the left, and there is no fried rice or similar dishes in the picture on the right.', 'sentence': 'Left part scenario:a meal in a banana leaf ,right part scenario: a meal. Therefore, the sentence is right or wrong: There is fried rice in the picture on the left, and there is no fried rice or similar dishes in the picture on the right.', 'prediction': 0, 'label': 0}
571	56-6##56-20	0	1	{'org_sentence': 'There is fried rice in the picture on the left, and there is no fried rice or similar dishes in the picture on the right.', 'sentence': 'There is fried rice in the picture on the left, and there is no fried rice or similar dishes in the picture on the right.', 'prediction': 1, 'label': 1}	{'org_sentence': 'There is fried rice in the picture on the left, and there is no fried rice or similar dishes in the picture on the right.', 'sentence': 'Left part scenario:a plate of rice ,right part scenario: a plate of food. Therefore, the sentence is right or wrong: There is fried rice in the picture on the left, and there is no fried rice or similar dishes in the picture on the right.', 'prediction': 0, 'label': 1}
574	15-6##15-11	1	0	{'org_sentence': 'The birch tree in one picture is clearly sawn off, the other is not.', 'sentence': 'The birch tree in one picture is clearly sawn off, the other is not.', 'prediction': 0, 'label': 1}	{'org_sentence': 'The birch tree in one picture is clearly sawn off, the other is not.', 'sentence': 'Left part scenario:forest ,right part scenario: wood. Therefore, the sentence is right or wrong: The birch tree in one picture is clearly sawn off, the other is not.', 'prediction': 1, 'label': 1}
579	24-1##24-12	0	1	{'org_sentence': 'The cabbage in one picture has been cooked and served on a plate, while the other picture is not.', 'sentence': 'The cabbage in one picture has been cooked and served on a plate, while the other picture is not.', 'prediction': 1, 'label': 1}	{'org_sentence': 'The cabbage in one picture has been cooked and served on a plate, while the other picture is not.', 'sentence': 'Left part scenario:asian ,right part scenario: a grocery store. Therefore, the sentence is right or wrong: The cabbage in one picture has been cooked and served on a plate, while the other picture is not.', 'prediction': 0, 'label': 1}
580	24-8##24-13	-1	0	{'org_sentence': 'The cabbage in one picture has been cooked and served on a plate, while the other picture is not.', 'sentence': 'The cabbage in one picture has been cooked and served on a plate, while the other picture is not.', 'prediction': 1, 'label': 0}	{'org_sentence': 'The cabbage in one picture has been cooked and served on a plate, while the other picture is not.', 'sentence': 'Left part scenario:a bowl of collard greens ,right part scenario: a field of green crops. Therefore, the sentence is right or wrong: The cabbage in one picture has been cooked and served on a plate, while the other picture is not.', 'prediction': 0, 'label': 0}
581	10-12##10-7	0	-1	{'org_sentence': 'The picture on the right has at least two dark cows, and the picture on the left has one or more cows.', 'sentence': 'The picture on the right has at least two dark cows, and the picture on the left has one or more cows.', 'prediction': 0, 'label': 0}	{'org_sentence': 'The picture on the right has at least two dark cows, and the picture on the left has one or more cows.', 'sentence': 'Left part scenario:a cow standing in a field ,right part scenario: cows grazing in a field. Therefore, the sentence is right or wrong: The picture on the right has at least two dark cows, and the picture on the left has one or more cows.', 'prediction': 1, 'label': 0}
582	10-11##10-5	1	0	{'org_sentence': 'The picture on the right has at least two dark cows, and the picture on the left has one or more cows.', 'sentence': 'The picture on the right has at least two dark cows, and the picture on the left has one or more cows.', 'prediction': 0, 'label': 1}	{'org_sentence': 'The picture on the right has at least two dark cows, and the picture on the left has one or more cows.', 'sentence': 'Left part scenario:a wildebeest in the wild ,right part scenario: a watering hole. Therefore, the sentence is right or wrong: The picture on the right has at least two dark cows, and the picture on the left has one or more cows.', 'prediction': 1, 'label': 1}
584	10-8##10-3	0	1	{'org_sentence': 'The picture on the right has at least two dark cows, and the picture on the left has one or more cows.', 'sentence': 'The picture on the right has at least two dark cows, and the picture on the left has one or more cows.', 'prediction': 1, 'label': 1}	{'org_sentence': 'The picture on the right has at least two dark cows, and the picture on the left has one or more cows.', 'sentence': 'Left part scenario:a watering hole ,right part scenario: a herd of cows walking down a road. Therefore, the sentence is right or wrong: The picture on the right has at least two dark cows, and the picture on the left has one or more cows.', 'prediction': 0, 'label': 1}
587	19-10##19-12	0	1	{'org_sentence': 'You can see at least one blue or yellow orchid in the picture on the right, while the orchid on the left is lighter in color.', 'sentence': 'You can see at least one blue or yellow orchid in the picture on the right, while the orchid on the left is lighter in color.', 'prediction': 1, 'label': 1}	{'org_sentence': 'You can see at least one blue or yellow orchid in the picture on the right, while the orchid on the left is lighter in color.', 'sentence': 'Left part scenario:a white orchid ,right part scenario: indoors. Therefore, the sentence is right or wrong: You can see at least one blue or yellow orchid in the picture on the right, while the orchid on the left is lighter in color.', 'prediction': 0, 'label': 1}
600	35-9##35-7	0	-1	{'org_sentence': 'You can see the fruit used for worship in one picture, and there is no fruit in the other picture.', 'sentence': 'You can see the fruit used for worship in one picture, and there is no fruit in the other picture.', 'prediction': 0, 'label': 0}	{'org_sentence': 'You can see the fruit used for worship in one picture, and there is no fruit in the other picture.', 'sentence': 'Left part scenario:a street scene ,right part scenario: two boys standing in front of a barber shop. Therefore, the sentence is right or wrong: You can see the fruit used for worship in one picture, and there is no fruit in the other picture.', 'prediction': 1, 'label': 0}
605	8-1##8-9	0	1	{'org_sentence': 'There is only one dog in one picture, and at least two dogs of different colors in the other picture.', 'sentence': 'There is only one dog in one picture, and at least two dogs of different colors in the other picture.', 'prediction': 1, 'label': 1}	{'org_sentence': 'There is only one dog in one picture, and at least two dogs of different colors in the other picture.', 'sentence': 'Left part scenario:dog ,right part scenario: dog. Therefore, the sentence is right or wrong: One of the pictures shows a newborn puppy, and the other shows a Dalmatian.', 'prediction': 0, 'label': 1}
606	8-8##8-2	-1	0	{'org_sentence': 'There is only one dog in one picture, and at least two dogs of different colors in the other picture.', 'sentence': 'There is only one dog in one picture, and at least two dogs of different colors in the other picture.', 'prediction': 1, 'label': 0}	{'org_sentence': 'There is only one dog in one picture, and at least two dogs of different colors in the other picture.', 'sentence': 'Left part scenario:dog ,right part scenario: puppy. Therefore, the sentence is right or wrong: There is only one dog in one picture, and at least two dogs of different colors in the other picture.', 'prediction': 0, 'label': 0}
609	43-6##43-9	1	0	{'org_sentence': 'There are exactly three people wearing similar Tang suits in the picture on the left, and there are only one or two people in the picture on the right.', 'sentence': 'There are exactly three people wearing similar Tang suits in the picture on the left, and there are only one or two people in the picture on the right.', 'prediction': 0, 'label': 1}	{'org_sentence': 'There are exactly three people wearing similar Tang suits in the picture on the left, and there are only one or two people in the picture on the right.', 'sentence': 'Left part scenario:sitting ,right part scenario: japanese. Therefore, the sentence is right or wrong: There are exactly three people wearing similar Tang suits in the picture on the left, and there are only one or two people in the picture on the right.', 'prediction': 1, 'label': 1}
616	36-6##36-14	0	-1	{'org_sentence': 'There are many heart-shaped decorations on the right, and bear dolls or lights on the left.', 'sentence': 'There are many heart-shaped decorations on the right, and bear dolls or lights on the left.', 'prediction': 0, 'label': 0}	{'org_sentence': 'There are many heart-shaped decorations on the right, and bear dolls or lights on the left.', 'sentence': "Left part scenario:a valentine's day ,right part scenario: a blurry picture of a flower. Therefore, the sentence is right or wrong: There are many heart-shaped decorations on the right, and bear dolls or lights on the left.", 'prediction': 1, 'label': 0}
617	61-12##61-4	0	-1	{'org_sentence': 'The milk tea in both pictures has pearls, and the picture on the left happens to have only one cup.', 'sentence': 'The milk tea in both pictures has pearls, and the picture on the left happens to have only one cup.', 'prediction': 0, 'label': 0}	{'org_sentence': 'The milk tea in both pictures has pearls, and the picture on the left happens to have only one cup.', 'sentence': 'Left part scenario:a drink and newspaper on a wooden board ,right part scenario: a glass with a cookie in it. Therefore, the sentence is right or wrong: The milk tea in both pictures has pearls, and the picture on the left happens to have only one cup.', 'prediction': 1, 'label': 0}
620	61-6##61-10	0	1	{'org_sentence': 'The milk tea in both pictures has pearls, and the picture on the left happens to have only one cup.', 'sentence': 'The milk tea in both pictures has pearls, and the picture on the left happens to have only one cup.', 'prediction': 1, 'label': 1}	{'org_sentence': 'The milk tea in both pictures has pearls, and the picture on the left happens to have only one cup.', 'sentence': 'Left part scenario:a glass of chocolate milkshake ,right part scenario: a glass of bubble tea. Therefore, the sentence is right or wrong: The milk tea in both pictures has pearls, and the picture on the left happens to have only one cup.', 'prediction': 0, 'label': 1}
624	44-6##44-7	0	1	{'org_sentence': 'There are people wearing red cheongsam in both pictures, and there is more than one person in one picture.', 'sentence': 'There are people wearing red cheongsam in both pictures, and there is more than one person in one picture.', 'prediction': 1, 'label': 1}	{'org_sentence': 'There are people wearing red cheongsam in both pictures, and there is more than one person in one picture.', 'sentence': 'Left part scenario:asian women performing a dance ,right part scenario: a formal event. Therefore, the sentence is right or wrong: There are people wearing red cheongsam in both pictures, and there is more than one person in one picture.', 'prediction': 0, 'label': 1}
625	28-3##28-1	-1	0	{'org_sentence': 'The players on the left are all wearing basketball vests, but the people on the right are not necessarily.', 'sentence': 'The players on the left are all wearing basketball vests, but the people on the right are not necessarily.', 'prediction': 1, 'label': 0}	{'org_sentence': 'The players on the left are all wearing basketball vests, but the people on the right are not necessarily.', 'sentence': 'Left part scenario:a basketball court ,right part scenario: a basketball court. Therefore, the sentence is right or wrong: The players on the left are all wearing basketball vests, but the people on the right are not necessarily.', 'prediction': 0, 'label': 0}
626	28-8##28-6	1	0	{'org_sentence': 'The players on the left are all wearing basketball vests, but the people on the right are not necessarily.', 'sentence': 'The players on the left are all wearing basketball vests, but the people on the right are not necessarily.', 'prediction': 0, 'label': 1}	{'org_sentence': 'The players on the left are all wearing basketball vests, but the people on the right are not necessarily.', 'sentence': 'Left part scenario:a basketball game ,right part scenario: a basketball court. Therefore, the sentence is right or wrong: The players on the left are all wearing basketball vests, but the people on the right are not necessarily.', 'prediction': 1, 'label': 1}
630	12-6##12-4	-1	0	{'org_sentence': 'In the picture on the right, you can see obvious green space besides the willow trees, while the picture on the left has no green space.', 'sentence': 'In the picture on the right, you can see obvious green space besides the willow trees, while the picture on the left has no green space.', 'prediction': 1, 'label': 0}	{'org_sentence': 'In the picture on the right, you can see obvious green space besides the willow trees, while the picture on the left has no green space.', 'sentence': 'Left part scenario:walkway ,right part scenario: a school playground. Therefore, the sentence is right or wrong: In the picture on the right, you can see obvious green space besides the willow trees, while the picture on the left has no green space.', 'prediction': 0, 'label': 0}
632	12-8##12-7	0	-1	{'org_sentence': 'In the picture on the right, you can see obvious green space besides the willow trees, while the picture on the left has no green space.', 'sentence': 'In the picture on the right, you can see obvious green space besides the willow trees, while the picture on the left has no green space.', 'prediction': 0, 'label': 0}	{'org_sentence': 'In the picture on the right, you can see obvious green space besides the willow trees, while the picture on the left has no green space.', 'sentence': 'Left part scenario:a lake ,right part scenario: winter. Therefore, the sentence is right or wrong: In the picture on the right, you can see obvious green space besides the willow trees, while the picture on the left has no green space.', 'prediction': 1, 'label': 0}
633	39-15##39-9	-1	0	{'org_sentence': 'There is no knife on the cutting board in the right picture, and there is a knife on the cutting board in the left picture.', 'sentence': 'There is no knife on the cutting board in the right picture, and there is a knife on the cutting board in the left picture.', 'prediction': 1, 'label': 0}	{'org_sentence': 'There is no knife on the cutting board in the right picture, and there is a knife on the cutting board in the left picture.', 'sentence': 'Left part scenario:a kitchen ,right part scenario: a kitchen. Therefore, the sentence is right or wrong: There is no knife on the cutting board in the right picture, and there is a knife on the cutting board in the left picture.', 'prediction': 0, 'label': 0}
634	39-6##39-19	0	1	{'org_sentence': 'There is no knife on the cutting board in the right picture, and there is a knife on the cutting board in the left picture.', 'sentence': 'There is no knife on the cutting board in the right picture, and there is a knife on the cutting board in the left picture.', 'prediction': 1, 'label': 1}	{'org_sentence': 'There is no knife on the cutting board in the right picture, and there is a knife on the cutting board in the left picture.', 'sentence': 'Left part scenario:a kitchen ,right part scenario: cut meat. Therefore, the sentence is right or wrong: There is no knife on the cutting board in the right picture, and there is a knife on the cutting board in the left picture.', 'prediction': 0, 'label': 1}
635	39-5##39-16	0	-1	{'org_sentence': 'There is no knife on the cutting board in the right picture, and there is a knife on the cutting board in the left picture.', 'sentence': 'There is no knife on the cutting board in the right picture, and there is a knife on the cutting board in the left picture.', 'prediction': 0, 'label': 0}	{'org_sentence': 'There is no knife on the cutting board in the right picture, and there is a knife on the cutting board in the left picture.', 'sentence': 'Left part scenario:carrots on a cutting board ,right part scenario: cut up cherry tomatoes. Therefore, the sentence is right or wrong: There are knives and chopping boards in both pictures, and one of them has a sliced cucumber.', 'prediction': 1, 'label': 0}
636	39-1##39-8	1	0	{'org_sentence': 'There is no knife on the cutting board in the right picture, and there is a knife on the cutting board in the left picture.', 'sentence': 'There is no knife on the cutting board in the right picture, and there is a knife on the cutting board in the left picture.', 'prediction': 0, 'label': 1}	{'org_sentence': 'There is no knife on the cutting board in the right picture, and there is a knife on the cutting board in the left picture.', 'sentence': 'Left part scenario:kitchen ,right part scenario: cutting tomatoes. Therefore, the sentence is right or wrong: There is no knife on the cutting board in the right picture, and there is a knife on the cutting board in the left picture.', 'prediction': 1, 'label': 1}
638	9-2##9-5	0	-1	{'org_sentence': 'There happens to be only one giant panda in both pictures, and the giant panda in the right picture is not moving.', 'sentence': 'There happens to be only one giant panda in both pictures, and the giant panda in the right picture is not moving.', 'prediction': 0, 'label': 0}	{'org_sentence': 'There happens to be only one giant panda in both pictures, and the giant panda in the right picture is not moving.', 'sentence': 'Left part scenario:two pandas in a zoo ,right part scenario: panda bear. Therefore, the sentence is right or wrong: There happens to be only one giant panda in both pictures, and the giant panda in the right picture is not moving.', 'prediction': 1, 'label': 0}
641	38-5##38-8	-1	0	{'org_sentence': 'The soup ladle in the right picture is made of metal, and the left picture has at least two non-metallic soup ladles.', 'sentence': 'The soup ladle in the right picture is made of metal, and the left picture has at least two non-metallic soup ladles.', 'prediction': 1, 'label': 0}	{'org_sentence': 'The soup ladle in the right picture is made of metal, and the left picture has at least two non-metallic soup ladles.', 'sentence': 'Left part scenario:three spoons on a kitchen counter ,right part scenario: 3d. Therefore, the sentence is right or wrong: The soup ladle in the right picture is made of metal, and the left picture has at least two non-metallic soup ladles.', 'prediction': 0, 'label': 0}
642	38-3##38-9	0	1	{'org_sentence': 'The soup ladle in the right picture is made of metal, and the left picture has at least two non-metallic soup ladles.', 'sentence': 'The soup ladle in the right picture is made of metal, and the left picture has at least two non-metallic soup ladles.', 'prediction': 1, 'label': 1}	{'org_sentence': 'The soup ladle in the right picture is made of metal, and the left picture has at least two non-metallic soup ladles.', 'sentence': 'Left part scenario:a person reaching into a bowl of soup ,right part scenario: a spoon on a plate. Therefore, the sentence is right or wrong: The soup ladle in the right picture is made of metal, and the left picture has at least two non-metallic soup ladles.', 'prediction': 0, 'label': 1}
643	38-4##38-12	1	0	{'org_sentence': 'The soup ladle in the right picture is made of metal, and the left picture has at least two non-metallic soup ladles.', 'sentence': 'The soup ladle in the right picture is made of metal, and the left picture has at least two non-metallic soup ladles.', 'prediction': 0, 'label': 1}	{'org_sentence': 'The soup ladle in the right picture is made of metal, and the left picture has at least two non-metallic soup ladles.', 'sentence': 'Left part scenario:three white bowls on a black tray ,right part scenario: a bowl of rice. Therefore, the sentence is right or wrong: The soup ladle in the right picture is made of metal, and the left picture has at least two non-metallic soup ladles.', 'prediction': 1, 'label': 1}
646	23-5##23-7	0	1	{'org_sentence': 'In the picture on the right, besides the potatoes, there is a peeler, and on the left, there are several potatoes that have not been peeled.', 'sentence': 'In the picture on the right, besides the potatoes, there is a peeler, and on the left, there are several potatoes that have not been peeled.', 'prediction': 1, 'label': 1}	{'org_sentence': 'In the picture on the right, besides the potatoes, there is a peeler, and on the left, there are several potatoes that have not been peeled.', 'sentence': 'Left part scenario:a grocery store ,right part scenario: a kitchen scene. Therefore, the sentence is right or wrong: In the picture on the right, besides the potatoes, there is a peeler, and on the left, there are several potatoes that have not been peeled.', 'prediction': 0, 'label': 1}
